section_name,short_description,about,suggested_actions
MEASURE 1.1,Approaches and metrics for measurement of AI risks enumerated during the Map function are selected for implementation starting with the most significant AI risks. The risks or trustworthiness characteristics that will not – or cannot – be measured are properly documented.,"The development and utility of trustworthy AI systems depends on reliable measurements and evaluations of underlying technologies and their use. Compared with traditional software systems, AI technologies bring new failure modes, inherent dependence on training data and methods which directly tie to data quality and representativeness. Additionally, AI systems are inherently socio-technical in nature, meaning they are influenced by societal dynamics and human behavior. AI risks – and benefits – can emerge from the interplay of technical aspects combined with societal factors related to how a system is used, its interactions with other AI systems, who operates it, and the social context in which it is deployed. In other words, What should be measured depends on the purpose, audience, and needs of the evaluations. These two factors influence selection of approaches and metrics for measurement of AI risks enumerated during the Map function. The AI landscape is evolving and so are the methods and metrics for AI measurement. The evolution of metrics is key to maintaining efficacy of the measures.","• Establish approaches for detecting, tracking and measuring known risks, errors, incidents or negative impacts. • Identify testing procedures and metrics to demonstrate whether or not the system is fit for purpose and functioning as claimed. • Identify testing procedures and metrics to demonstrate AI system trustworthiness • Define acceptable limits for system performance (e.g. distribution of errors), and include course correction suggestions if/when the system performs beyond acceptable limits. • Define metrics for, and regularly assess, AI actor competency for effective system operation, • Identify transparency metrics to assess whether stakeholders have access to necessary information about system design, development, deployment, use, and evaluation. • Utilize accountability metrics to determine whether AI designers, developers, and deployers maintain clear and transparent lines of responsibility and are open to inquiries. • Document metric selection criteria and include considered but unused metrics. 93 of 142 • Monitor AI system external inputs including training data, models developed for other contexts, system components reused from other contexts, and third-party tools and resources. • Report metrics to inform assessments of system generalizability and reliability. • Assess and document pre- vs post-deployment system performance. Include existing and emergent risks. • Document risks or trustworthiness characteristics identified in the Map function that will not be measured, including justification for non- measurement."
MEASURE 1.2,Appropriateness of AI metrics and effectiveness of existing controls is regularly assessed and updated including reports of errors and impacts on affected communities.,"Different AI tasks, such as neural networks or natural language processing, benefit from different evaluation techniques. Use-case and particular settings in which the AI system is used also affects appropriateness of the evaluation techniques. Changes in the operational settings, data drift, model drift are among factors that suggest regularly assessing and updating appropriateness of AI metrics and their effectiveness can enhance reliability of AI system measurements.","• Assess external validity of all measurements (e.g., the degree to which measurements taken in one context can generalize to other contexts). • Assess effectiveness of existing metrics and controls on a regular basis throughout the AI system lifecycle. • Document reports of errors, incidents and negative impacts and assess sufficiency and efficacy of existing metrics for repairs, and upgrades • Develop new metrics when existing metrics are insufficient or ineffective for implementing repairs and upgrades. • Develop and utilize metrics to monitor, characterize and track external inputs, including any third-party tools. • Determine frequency and scope for sharing metrics and related information with stakeholders and impacted communities. • Utilize stakeholder feedback processes established in the Map function to capture, act upon and share feedback from end users and potentially impacted communities. • Collect and report software quality metrics such as rates of bug occurrence and severity, time to response, and time to repair (See Manage 4.3)."
MEASURE 1.3,"Internal experts who did not serve as front-line developers for the system and/or independent assessors are involved in regular assessments and updates. Domain experts, users, AI actors external to the team that developed or deployed the AI system, and affected communities are consulted in support of assessments as necessary per organizational risk tolerance.","The current AI systems are brittle, the failure modes are not well described, and the systems are dependent on the context in which they were developed and do not transfer well outside of the training environment. A reliance on local evaluations will be necessary along with a continuous monitoring of these systems. Measurements that extend beyond classical measures (which average across test cases) or expand to focus on pockets of failures where there are potentially significant costs can improve the reliability of risk management activities. Feedback from affected communities about how AI systems are being used can make AI evaluation purposeful. Involving internal experts who did not serve as front-line developers for the system and/or independent assessors regular assessments of AI systems helps a fulsome characterization of AI systems’ performance and trustworthiness . 96 of 142","• Evaluate TEVV processes regarding incentives to identify risks and impacts. • Utilize separate testing teams established in the Govern function (2.1 and 4.1) to enable independent decisions and course-correction for AI systems. Track processes and measure and document change in performance. • Plan and evaluate AI system prototypes with end user populations early and continuously in the AI lifecycle. Document test outcomes and course correct. • Assess independence and stature of TEVV and oversight AI actors, to ensure they have the required levels of independence and resources to perform assurance, compliance, and feedback tasks effectively • Evaluate interdisciplinary and demographically diverse internal team established in"
MEASURE 2.1,"Test sets, metrics, and details about the tools used during test, evaluation, validation, and verification (TEVV) are documented.","Documenting measurement approaches, test sets, metrics, processes and materials used, and associated details builds foundation upon which to build a valid, reliable measurement process. Documentation enables repeatability and consistency, and can enhance AI risk management decisions.","• Leverage existing industry best practices for transparency and documentation of all possible aspects of measurements. Examples include: data sheet for data sets, model cards • Regularly assess the effectiveness of tools used to document measurement approaches, test sets, metrics, processes and materials used • Update the tools as needed"
MEASURE 2.2,Evaluations involving human subjects meet applicable requirements (including human subject protection) and are representative of the relevant population.,"Measurement and evaluation of AI systems often involves testing with human subjects or using data captured from human subjects. Protection of human subjects is required by law when carrying out federally funded research, and is a domain specific requirement for some disciplines. Standard human subjects protection procedures include protecting the welfare 99 of 142 and interests of human subjects, designing evaluations to minimize risks to subjects, and completion of mandatory training regarding legal requirements and expectations. Evaluations of AI system performance that utilize human subjects or human subject data should reflect the population within the context of use. AI system activities utilizing non- representative data may lead to inaccurate assessments or negative and harmful outcomes. It is often difficult – and sometimes impossible, to collect data or perform evaluation tasks that reflect the full operational purview of an AI system. Methods for collecting, annotating, or using these data can also contribute to the challenge. To counteract these challenges, organizations can connect human subjects data collection, and dataset practices, to AI system contexts and purposes and do so in close collaboration with AI Actors from the relevant domains.","• Follow human subjects research requirements as established by organizational and disciplinary requirements, including informed consent and compensation, during dataset collection activities. • Analyze differences between intended and actual population of users or data subjects, including likelihood for errors, incidents or negative impacts. • Utilize disaggregated evaluation methods (e.g. by race, age, gender, ethnicity, ability, region) to improve AI system performance when deployed in real world settings. • Establish thresholds and alert procedures for dataset representativeness within the context of use. • Construct datasets in close collaboration with experts with knowledge of the context of use. • Follow intellectual property and privacy rights related to datasets and their use, including for the subjects represented in the data. • Evaluate data representativeness through • investigating known failure modes, • assessing data quality and diverse sourcing, • applying public benchmarks, • traditional bias testing, • chaos engineering, • stakeholder feedback • Use informed consent for individuals providing data used in system testing and evaluation."
MEASURE 2.3,AI system performance or assurance criteria are measured qualitatively or quantitatively and demonstrated for conditions similar to deployment setting(s). Measures are documented.,"The current risk and impact environment suggests AI system performance estimates are insufficient and require a deeper understanding of deployment context of use. Computationally focused performance testing and evaluation schemes are restricted to test data sets and in silico techniques. These approaches do not directly evaluate risks and impacts in real world environments and can only predict what might create impact based on an approximation of expected AI use. To properly manage risks, more direct information is necessary to understand how and under what conditions deployed AI creates impacts, who is most likely to be impacted, and what that experience is like.","• Conduct regular and sustained engagement with potentially impacted communities • Maintain a demographically diverse and multidisciplinary and collaborative internal team 102 of 142 • Regularly test and evaluate systems in non-optimized conditions, and in collaboration with AI actors in user interaction and user experience (UI/UX) roles. • Evaluate feedback from stakeholder engagement activities, in collaboration with human factors and socio-technical experts. • Collaborate with socio-technical, human factors, and UI/UX experts to identify notable characteristics in context of use that can be translated into system testing scenarios. • Measure AI systems prior to deployment in conditions similar to expected scenarios. • Measure and document performance criteria such as validity (false positive rate, false negative rate, etc.) and efficiency (training times, prediction latency, etc.) related to ground truth within the deployment context of use. • Measure assurance criteria such as AI actor competency and experience. • Document differences between measurement setting and the deployment environment(s)."
MEASURE 2.4,The functionality and behavior of the AI system and its components – as identified in the MAP function – are monitored when in production.,"AI systems may encounter new issues and risks while in production as the environment evolves over time. This effect, often referred to as “drift”, means AI systems no longer meet the assumptions and limitations of the original design. Regular monitoring allows AI Actors to monitor the functionality and behavior of the AI system and its components – as identified in the MAP function - and enhance the speed and efficacy of necessary system interventions.","• Monitor and document how metrics and performance indicators observed in production differ from the same metrics collected during pre-deployment testing. When differences are observed, consider error propagation and feedback loop risks. 104 of 142 • Utilize hypothesis testing or human domain expertise to measure monitored distribution differences in new input or output data relative to test environments • Monitor for anomalies using approaches such as control limits, confidence intervals, integrity constraints and ML algorithms. When anomalies are observed, consider error propagation and feedback loop risks. • Verify alerts are in place for when distributions in new input data or generated predictions observed in production differ from pre-deployment test outcomes, or when anomalies are detected. • Assess the accuracy and quality of generated outputs against new collected ground- truth information as it becomes available. • Utilize human review to track processing of unexpected data and reliability of generated outputs; warn system users when outputs may be unreliable. Verify that human overseers responsible for these processes have clearly defined responsibilities and training for specified tasks. • Collect uses cases from the operational environment for system testing and monitoring activities in accordance with organizational policies and regulatory or disciplinary requirements (e.g. informed consent, institutional review board approval, human research protections),"
MEASURE 2.5,The AI system to be deployed is demonstrated to be valid and reliable. Limitations of the generalizability beyond the conditions under which the technology was developed are documented.,"An AI system that is not validated or that fails validation may be inaccurate or unreliable or may generalize poorly to data and settings beyond its training, creating and increasing AI risks and reducing trustworthiness. AI Actors can improve system validity by creating processes for exploring and documenting system limitations. This includes broad consideration of purposes and uses for which the system was not designed. Validation risks include the use of proxies or other indicators that are often constructed by AI development teams to operationalize phenomena that are either not directly observable or measurable (e.g, fairness, hireability, honesty, propensity to commit a crime). Teams can mitigate these risks by demonstrating that the indicator is measuring the concept it claims to measure (also known as construct validity). Without this and other types of validation, various negative properties or impacts may go undetected, including the presence of confounding variables, potential spurious correlations, or error propagation and its potential impact on other interconnected systems.","• Define the operating conditions and socio-technical context under which the AI system will be validated. • Define and document processes to establish the system’s operational conditions and limits. • Establish or identify, and document approaches to measure forms of validity, including: • construct validity (the test is measuring the concept it claims to measure) • internal validity (relationship being tested is not influenced by other factors or variables) • external validity (results are generalizable beyond the training condition) • the use of experimental design principles and statistical analyses and modeling. • Assess and document system variance. Standard approaches include confidence intervals, standard deviation, standard error, bootstrapping, or cross-validation. • Establish or identify, and document robustness measures. • Establish or identify, and document reliability measures. • Establish practices to specify and document the assumptions underlying measurement models to ensure proxies accurately reflect the concept being measured. • Utilize standard software testing approaches (e.g. unit, integration, functional and chaos testing, computer-generated test cases, etc.) • Utilize standard statistical methods to test bias, inferential associations, correlation, and covariance in adopted measurement models. 106 of 142 • Utilize standard statistical methods to test variance and reliability of system outcomes. • Monitor operating conditions for system performance outside of defined limits. • Identify TEVV approaches for exploring AI system limitations, including testing scenarios that differ from the operational environment. Consult experts with knowledge of specific context of use. • Define post-alert actions. Possible actions may include: • alerting other relevant AI actors before action, • requesting subsequent human review of action, • alerting downstream users and stakeholder that the system is operating outside it’s defined validity limits, • tracking and mitigating possible error propagation • action logging • Log input data and relevant system configuration information whenever there is an attempt to use the system beyond its well-defined range of system validity. • Modify the system over time to extend its range of system validity to new operating conditions."
MEASURE 2.6,"AI system is evaluated regularly for safety risks – as identified in the MAP function. The AI system to be deployed is demonstrated to be safe, its residual negative risk does not exceed the risk tolerance, and can fail safely, particularly if made to operate beyond its knowledge limits. Safety metrics implicate system reliability and robustness, real-time monitoring, and response times for AI system failures.","Many AI systems are being introduced into settings such as transportation, manufacturing or security, where failures may give rise to various physical or environmental harms. AI systems that may endanger human life, health, property or the environment are tested thoroughly prior to deployment, and are regularly evaluated to confirm the system is safe during normal operations, and in settings beyond its proposed use and knowledge limits. Measuring activities for safety often relate to exhaustive testing in development and deployment contexts, understanding the limits of a system’s reliable, robust, and safe behavior, and real-time monitoring of various aspects of system performance. These activities are typically conducted along with other risk mapping, management, and governance tasks such as avoiding past failed designs, establishing and rehearsing incident response plans that enable quick responses to system problems, the instantiation of redundant functionality to cover failures, and transparent and accountable governance. System safety incidents or failures are frequently reported to be related to organizational dynamics and culture. Independent auditors may bring important independent perspectives for reviewing evidence of AI system safety. 108 of 142","• Thoroughly measure system performance in development and deployment contexts, and under stress conditions. • Employ test data assessments and simulations before proceeding to production testing. Track multiple performance quality and error metrics. • Stress-test system performance under likely scenarios (e.g., concept drift, high load) and beyond known limitations, in consultation with domain experts. • Test the system under conditions similar to those related to past known incidents or near-misses and measure system performance and safety characteristics • Apply chaos engineering approaches to test systems in extreme conditions and gauge unexpected responses. • Document the range of conditions under which the system has been tested and demonstrated to fail safely. • Measure and monitor system performance in real-time to enable rapid response when AI system incidents are detected. • Collect pertinent safety statistics (e.g., out-of-range performance, incident response times, system down time, injuries, etc.) in anticipation of potential information sharing with impacted communities or as required by AI system oversight personnel. • Align measurement to the goal of continuous improvement. Seek to increase the range of conditions under which the system is able to fail safely through system modifications in response to in-production testing and events. • Document, practice and measure incident response plans for AI system incidents, including measuring response and down times. • Compare documented safety testing and monitoring information with established risk tolerances on an on-going basis. • Consult MANAGE for detailed information related to managing safety risks."
MEASURE 2.7,AI system security and resilience – as identified in the MAP function – are evaluated and documented.,"AI systems, as well as the ecosystems in which they are deployed, may be said to be resilient if they can withstand unexpected adverse events or unexpected changes in their environment or use – or if they can maintain their functions and structure in the face of internal and external change and degrade safely and gracefully when this is necessary. Common security concerns relate to adversarial examples, data poisoning, and the exfiltration of models, training data, or other intellectual property through AI system endpoints. AI systems that can maintain confidentiality, integrity, and availability through protection mechanisms that prevent unauthorized access and use may be said to be secure. Security and resilience are related but distinct characteristics. While resilience is the ability to return to normal function after an unexpected adverse event, security includes resilience but also encompasses protocols to avoid, protect against, respond to, or recover 110 of 142 from attacks. Resilience relates to robustness and encompasses unexpected or adversarial use (or abuse or misuse) of the model or data.","• Establish and track AI system security tests and metrics (e.g., red-teaming activities, frequency and rate of anomalous events, system down-time, incident response times, time-to-bypass, etc.). • Use red-team exercises to actively test the system under adversarial or stress conditions, measure system response, assess failure modes or determine if system can return to normal function after an unexpected adverse event. • Document red-team exercise results as part of continuous improvement efforts, including the range of security test conditions and results. • Use red-teaming exercises to evaluate potential mismatches between claimed and actual system performance. • Use countermeasures (e.g, authentication, throttling, differential privacy, robust ML approaches) to increase the range of security conditions under which the system is able to return to normal function. • Modify system security procedures and countermeasures to increase robustness and resilience to attacks in response to testing and events experienced in production. • Verify that information about errors and attack patterns is shared with incident databases, other organizations with similar systems, and system users and stakeholders (MANAGE-4.1). • Develop and maintain information sharing practices with AI actors from other organizations to learn from common attacks. • Verify that third party AI resources and personnel undergo security audits and screenings. Risk indicators may include failure of third parties to provide relevant security information. • Utilize watermarking technologies as a deterrent to data and model extraction attacks."
