section_name,short_description,about,suggested_actions
MAP 2.1,"The specific task, and methods used to implement the task, that the AI system will support is defined (e.g., classifiers, generative models, recommenders).","AI actors define the technical learning or decision-making task(s) an AI system is designed to accomplish, or the benefits that the system will provide. The clearer and narrower the task definition, the easier it is to map its benefits and risks, leading to more fulsome risk management.",• Define and document AI system’s existing and potential learning task(s) along with known assumptions and limitations.
MAP 2.2,Information about the AI system’s knowledge limits and how system output may be utilized and overseen by humans is documented. Documentation provides sufficient information to assist relevant AI actors when making informed decisions and taking subsequent actions.,"An AI lifecycle consists of many interdependent activities involving a diverse set of actors that often do not have full visibility or control over other parts of the lifecycle and its associated contexts or risks. The interdependencies between these activities, and among the relevant AI actors and organizations, can make it difficult to reliably anticipate potential impacts of AI systems. For example, early decisions in identifying the purpose and objective of an AI system can alter its behavior and capabilities, and the dynamics of deployment setting (such as end users or impacted individuals) can shape the positive or negative impacts of AI system decisions. As a result, the best intentions within one dimension of the AI lifecycle can be undermined via interactions with decisions and conditions in other, later activities. This complexity and varying levels of visibility can introduce uncertainty. And, once deployed and in use, AI systems may sometimes perform poorly, manifest unanticipated negative impacts, or violate legal or ethical norms. These risks and incidents can result from a variety of factors. For example, downstream decisions can be influenced by end user over-trust or under-trust, and other complexities related to AI-supported decision-making. Anticipating, articulating, assessing and documenting AI systems’ knowledge limits and how system output may be utilized and overseen by humans can help mitigate the uncertainty associated with the realities of AI system deployments. Rigorous design processes include defining system knowledge limits, which are confirmed and refined based on TEVV processes.","• Document settings, environments and conditions that are outside the AI system’s intended use. 71 of 142 • Design for end user workflows and toolsets, concept of operations, and explainability and interpretability criteria in conjunction with end user(s) and associated qualitative feedback. • Plan and test human-AI configurations under close to real-world conditions and document results. • Follow stakeholder feedback processes to determine whether a system achieved its documented purpose within a given use context, and whether end users can correctly comprehend system outputs or results. • Document dependencies on upstream data and other AI systems, including if the specified system is an upstream dependency for another AI system or other data. • Document connections the AI system or data will have to external networks (including the internet), financial markets, and critical infrastructure that have potential for negative externalities. Identify and document negative impacts as part of considering the broader risk thresholds and subsequent go/no-go deployment as well as post- deployment decommissioning decisions."
MAP 2.3,"Scientific integrity and TEVV considerations are identified and documented, including those related to experimental design, data collection and selection (e.g., availability, representativeness, suitability), system trustworthiness, and construct validation.","Standard testing and evaluation protocols provide a basis to confirm assurance in a system that it is operating as designed and claimed. AI systems’ complexities create challenges for traditional testing and evaluation methodologies, which tend to be designed for static or isolated system performance. Opportunities for risk continue well beyond design and deployment, into system operation and application of system-enabled decisions. Testing and evaluation methodologies and metrics therefore address a continuum of activities. TEVV is enhanced when key metrics for performance, safety, and reliability are interpreted in a socio-technical context and not confined to the boundaries of the AI system pipeline. Other challenges for managing AI risks relate to dependence on large scale datasets, which can impact data quality and validity concerns. The difficulty of finding the “right” data may lead AI actors to select datasets based more on accessibility and availability than on suitability for operationalizing the phenomenon that the AI system intends to support or inform. Such decisions could contribute to an environment where the data used in processes is not fully representative of the populations or phenomena that are being modeled, introducing downstream risks. Practices such as dataset reuse may also lead to disconnect from the social contexts and time periods of their creation. This contributes to issues of validity of the underlying dataset for providing proxies, measures, or predictors within the model.","• Identify and document experiment design and statistical techniques that are valid for testing complex socio-technical systems like AI, which involve human factors, emergent properties, and dynamic context(s) of use. • Develop and apply TEVV protocols for models, system and its subcomponents, deployment, and operation. • Demonstrate and document that AI system performance and validation metrics are interpretable and unambiguous for downstream decision making tasks, and take socio- technical factors such as context of use into consideration. • Identify and document assumptions, techniques, and metrics used for testing and evaluation throughout the AI lifecycle including experimental design techniques for data collection, selection, and management practices in accordance with data governance policies established in GOVERN. 74 of 142 • Identify testing modules that can be incorporated throughout the AI lifecycle, and verify that processes enable corroboration by independent evaluators. • Establish mechanisms for regular communication and feedback among relevant AI actors and internal or external stakeholders related to the validity of design and deployment assumptions. • Establish mechanisms for regular communication and feedback between relevant AI actors and internal or external stakeholders related to the development of TEVV approaches throughout the lifecycle to detect and assess potentially harmful impacts • Document assumptions made and techniques used in data selection, curation, preparation and analysis, including: • identification of constructs and proxy targets, • development of indices – especially those operationalizing concepts that are inherently unobservable (e.g. “hireability,” “criminality.” “lendability”). • Map adherence to policies that address data and construct validity, bias, privacy and security for AI systems and verify documentation, oversight, and processes. • Identify and document transparent methods (e.g. causal discovery methods) for inferring causal relationships between constructs being modeled and dataset attributes or proxies. • Identify and document processes to understand and trace test and training data lineage and its metadata resources for mapping risks. • Document known limitations, risk mitigation efforts associated with, and methods used for, training data collection, selection, labeling, cleaning, and analysis (e.g. treatment of missing, spurious, or outlier data; biased estimators). • Establish and document practices to check for capabilities that are in excess of those that are planned for, such as emergent properties, and to revisit prior risk management steps in light of any new capabilities. • Establish processes to test and verify that design assumptions about the set of deployment contexts continue to be accurate and sufficiently complete. • Work with domain experts and other external AI actors to: • Gain and maintain contextual awareness and knowledge about how human behavior, organizational factors and dynamics, and society influence, and are represented in, datasets, processes, models, and system output. • Identify participatory approaches for responsible Human-AI configurations and oversight tasks, taking into account sources of cognitive bias. • Identify techniques to manage and mitigate sources of bias (systemic, computational, human- cognitive) in computational models and systems, and the assumptions and decisions in their development.. • Investigate and document potential negative impacts due related to the full product lifecycle and associated processes that may conflict with organizational values and principles. 75 of 142"
MAP 3.1,Potential benefits of intended AI system functionality and performance are examined and documented. 77 of 142,"AI systems have enormous potential to improve quality of life, enhance economic prosperity and security costs. Organizations are encouraged to define and document system purpose and utility, and its potential positive impacts and benefits beyond current known performance benchmarks. It is encouraged that risk management and assessment of benefits and impacts include processes for regular and meaningful communication with potentially affected groups and communities. These stakeholders can provide valuable input related to systems’ benefits and possible limitations. Organizations may differ in the types and number of stakeholders with which they engage. Other approaches such as human-centered design (HCD) and value-sensitive design (VSD) can help AI teams to engage broadly with individuals and communities. This type of engagement can enable AI teams to learn about how a given technology may cause positive or negative impacts, that were not originally considered or intended.","• Utilize participatory approaches and engage with system end users to understand and document AI systems’ potential benefits, efficacy and interpretability of AI task output. • Maintain awareness and documentation of the individuals, groups, or communities who make up the system’s internal and external stakeholders. • Verify that appropriate skills and practices are available in-house for carrying out participatory activities such as eliciting, capturing, and synthesizing user, operator and external feedback, and translating it for AI design and development functions. • Establish mechanisms for regular communication and feedback between relevant AI actors and internal or external stakeholders related to system design or deployment decisions. • Consider performance to human baseline metrics or other standard benchmarks. • Incorporate feedback from end users, and potentially impacted individuals and communities about perceived system benefits ."
MAP 3.2,"Potential costs, including non-monetary costs, which result from expected or realized AI errors or system functionality and trustworthiness - as connected to organizational risk tolerance - are examined and documented.","Anticipating negative impacts of AI systems is a difficult task. Negative impacts can be due to many factors, such as system non-functionality or use outside of its operational limits, and may range from minor annoyance to serious injury, financial losses, or regulatory enforcement actions. AI actors can work with a broad set of stakeholders to improve their capacity for understanding systems’ potential impacts – and subsequently – systems’ risks.","• Perform context analysis to map potential negative impacts arising from not integrating trustworthiness characteristics. When negative impacts are not direct or obvious, AI actors can engage with stakeholders external to the team that developed or deployed the AI system, and potentially impacted communities, to examine and document: • Who could be harmed? • What could be harmed? • When could harm arise? • How could harm arise? 79 of 142 • Identify and implement procedures for regularly evaluating the qualitative and quantitative costs of internal and external AI system failures. Develop actions to prevent, detect, and/or correct potential risks and related impacts. Regularly evaluate failure costs to inform go/no-go deployment decisions throughout the AI system lifecycle."
MAP 3.3,"Targeted application scope is specified and documented based on the system’s capability, established context, and AI system categorization. 80 of 142","Systems that function in a narrow scope tend to enable better mapping, measurement, and management of risks in the learning or decision-making tasks and the system context. A narrow application scope also helps ease TEVV functions and related resources within an organization. For example, large language models or open-ended chatbot systems that interact with the public on the internet have a large number of risks that may be difficult to map, measure, and manage due to the variability from both the decision-making task and the operational context. Instead, a task-specific chatbot utilizing templated responses that follow a defined “user journey” is a scope that can be more easily mapped, measured and managed.","• Consider narrowing contexts for system deployment, including factors related to: • How outcomes may directly or indirectly affect users, groups, communities and the environment. • Length of time the system is deployed in between re-trainings. • Geographical regions in which the system operates. • Dynamics related to community standards or likelihood of system misuse or abuses (either purposeful or unanticipated). • How AI system features and capabilities can be utilized within other applications, or in place of other existing processes. • Engage AI actors from legal and procurement functions when specifying target application scope."
MAP 3.4,"Processes for operator and practitioner proficiency with AI system performance and trustworthiness – and relevant technical standards and certifications – are defined, assessed and documented.","Human-AI configurations can span from fully autonomous to fully manual. AI systems can autonomously make decisions, defer decision-making to a human expert, or be used by a human decision-maker as an additional opinion. In some scenarios, professionals with expertise in a specific domain work in conjunction with an AI system towards a specific end goal—for example, a decision about another individual(s). Depending on the purpose of the system, the expert may interact with the AI system but is rarely part of the design or development of the system itself. These experts are not necessarily familiar with machine learning, data science, computer science, or other fields traditionally associated with AI design or development and - depending on the application - will likely not require such familiarity. For example, for AI systems that are deployed in health care delivery the experts are the physicians and bring their expertise about medicine—not data science, data modeling and engineering, or other computational factors. The challenge in these settings is not educating the end user about AI system capabilities, but rather leveraging, and not replacing, practitioner domain expertise. Questions remain about how to configure humans and automation for managing AI risks. Risk management is enhanced when organizations that design, develop or deploy AI systems for use by professional operators and practitioners: • are aware of these knowledge limitations and strive to identify risks in human-AI interactions and configurations across all contexts, and the potential resulting impacts, • define and differentiate the various human roles and responsibilities when using or interacting with AI systems, and • determine proficiency standards for AI system operation in proposed context of use, as enumerated in MAP-1 and established in GOVERN-3.2.","• Identify and declare AI system features and capabilities that may affect downstream AI actors’ decision-making in deployment and operational settings for example how system features and capabilities may activate known risks in various human-AI configurations, such as selective adherence. • Identify skills and proficiency requirements for operators, practitioners and other domain experts that interact with AI systems,Develop AI system operational 82 of 142 documentation for AI actors in deployed and operational environments, including information about known risks, mitigation criteria, and trustworthy characteristics enumerated in Map-1. • Define and develop training materials for proposed end users, practitioners and operators about AI system use and known limitations. • Define and develop certification procedures for operating AI systems within defined contexts of use, and information about what exceeds operational boundaries. • Include operators, practitioners and end users in AI system prototyping and testing activities to help inform operational boundaries and acceptable performance. Conduct testing activities under scenarios similar to deployment conditions. • Verify model output provided to AI system operators, practitioners and end users is interactive, and specified to context and user requirements defined in MAP-1. • Verify AI system output is interpretable and unambiguous for downstream decision making tasks. • Design AI system explanation complexity to match the level of problem and context complexity. • Verify that design principles are in place for safe operation by AI actors in decision- making environments. • Develop approaches to track human-AI configurations, operator, and practitioner outcomes for integration into continual improvement."
MAP 3.5,"Processes for human oversight are defined, assessed, and documented in accordance with organizational policies from GOVERN function.","As AI systems have evolved in accuracy and precision, computational systems have moved from being used purely for decision support—or for explicit use by and under the control of a human operator—to automated decision making with limited input from humans. Computational decision support systems augment another, typically human, system in making decisions.These types of configurations increase the likelihood of outputs being produced with little human involvement. 84 of 142 Defining and differentiating various human roles and responsibilities for AI systems’ governance, and differentiating AI system overseers and those using or interacting with AI systems can enhance AI risk management activities. In critical systems, high-stakes settings, and systems deemed high-risk it is of vital importance to evaluate risks and effectiveness of oversight procedures before an AI system is deployed. Ultimately, AI system oversight is a shared responsibility, and attempts to properly authorize or govern oversight practices will not be effective without organizational buy-in and accountability mechanisms, for example those suggested in the GOVERN function.","• Identify and document AI systems’ features and capabilities that require human oversight, in relation to operational and societal contexts, trustworthy characteristics, and risks identified in MAP-1. • Establish practices for AI systems’ oversight in accordance with policies developed in GOVERN-1. • Define and develop training materials for relevant AI Actors about AI system performance, context of use, known limitations and negative impacts, and suggested warning labels. • Include relevant AI Actors in AI system prototyping and testing activities. Conduct testing activities under scenarios similar to deployment conditions. • Evaluate AI system oversight practices for validity and reliability. When oversight practices undergo extensive updates or adaptations, retest, evaluate results, and course correct as necessary. • Verify that model documents contain interpretable descriptions of system mechanisms, enabling oversight personnel to make informed, risk-based decisions about system risks."
MAP 4.1,"Approaches for mapping AI technology and legal risks of its components – including the use of third-party data or software – are in place, followed, and documented, as are risks of infringement of a third-party’s intellectual property or other rights.","Technologies and personnel from third-parties are another potential sources of risk to consider during AI risk management activities. Such risks may be difficult to map since risk priorities or tolerances may not be the same as the deployer organization. For example, the use of pre-trained models, which tend to rely on large uncurated dataset or often have undisclosed origins, has raised concerns about privacy, bias, and unanticipated effects along with possible introduction of increased levels of statistical uncertainty, difficulty with reproducibility, and issues with scientific validity.","• Review audit reports, testing results, product roadmaps, warranties, terms of service, end user license agreements, contracts, and other documentation related to third-party entities to assist in value assessment and risk management activities. • Review third-party software release schedules and software change management plans (hotfixes, patches, updates, forward- and backward- compatibility guarantees) for irregularities that may contribute to AI system risks. 86 of 142 • Inventory third-party material (hardware, open-source software, foundation models, open source data, proprietary software, proprietary data, etc.) required for system implementation and maintenance. • Review redundancies related to third-party technology and personnel to assess potential risks due to lack of adequate support."
MAP 4.2,Internal risk controls for components of the AI system including third-party AI technologies are identified and documented.,"In the course of their work, AI actors often utilize open-source, or otherwise freely available, third-party technologies – some of which may have privacy, bias, and security risks. Organizations may consider internal risk controls for these technology sources and build up practices for evaluating third-party material prior to deployment.","• Track third-parties preventing or hampering risk-mapping as indications of increased risk. • Supply resources such as model documentation templates and software safelists to assist in third-party technology inventory and approval activities. • Review third-party material (including data and models) for risks related to bias, data privacy, and security vulnerabilities. • Apply traditional technology risk controls – such as procurement, security, and data privacy controls – to all acquired third-party technologies."
MAP 5.1,"Likelihood and magnitude of each identified impact (both potentially beneficial and harmful) based on expected use, past uses of AI systems in similar contexts, public incident reports, feedback from those external to the team that developed or deployed the AI system, or other data are identified and documented.","AI actors can evaluate, document and triage the likelihood of AI system impacts identified in",
MAP 5.2,"Practices and personnel for supporting regular engagement with relevant AI actors and integrating feedback about positive, negative, and unanticipated impacts are in place and documented.","AI systems are socio-technical in nature and can have positive, neutral, or negative implications that extend beyond their stated purpose. Negative impacts can be wide- ranging and affect individuals, groups, communities, organizations, and society, as well as the environment and national security. Organizations can create a baseline for system monitoring to increase opportunities for detecting emergent risks. After an AI system is deployed, engaging different stakeholder groups – who may be aware of, or experience, benefits or negative impacts that are unknown to AI actors involved in the design, development and deployment activities – allows organizations to understand and monitor system benefits and potential negative impacts more readily.","• Establish and document stakeholder engagement processes at the earliest stages of system formulation to identify potential impacts from the AI system on individuals, groups, communities, organizations, and society. • Employ methods such as value sensitive design (VSD) to identify misalignments between organizational and societal values, and system implementation and impact. • Identify approaches to engage, capture, and incorporate input from system end users and other key stakeholders to assist with continuous monitoring for potential impacts and emergent risks. 90 of 142 • Incorporate quantitative, qualitative, and mixed methods in the assessment and documentation of potential impacts to individuals, groups, communities, organizations, and society. • Identify a team (internal or external) that is independent of AI design and development functions to assess AI system benefits, positive and negative impacts and their likelihood and magnitude. • Evaluate and document stakeholder feedback to assess potential impacts for actionable insights regarding trustworthiness characteristics and changes in design approaches and principles. • Develop TEVV procedures that incorporate socio-technical elements and methods and plan to normalize across organizational culture. Regularly review and refine TEVV processes."
